{
  "@context": "https://schema.org",
  "type": "PresentationDigitalDocument",
  "name": {
    "de": "OERSI & SkoHub"
  },
  "creator": [
    {
      "id": "http://lobid.org/team/ap#!",
      "type": "Person",
      "name": "Adrian Pohl"
    }
  ],
  "description": {
    "de": "Pr√§sentation am 2020-08-26"
  },
  "keywords": [
    "oer",
    "open educational resources",
    "resource discovery",
    "oersi",
    "skohub"
  ],
  "about": [
    {
        "id": "https://lobid.org/project/oersi"
    },
    {
      "id": "https://lobid.org/product/skohub"
    }
],
  "id": "http://slides.lobid.org/2020-08-oersi-skohub/",
  "datePublished": "2020-08-24",
  "inLanguage": [
    "de"
  ],
  "license": "https://creativecommons.org/licenses/by/4.0/"
}