{
  "@context": "https://schema.org",
  "type": "BlogPosting",
  "name": {
    "en": "ActivityPub Conference 2020"
  },
  "creator": [
    {
      "id": "http://lobid.org/team/ap#!",
      "type": "Person",
      "name": "Adrian Pohl"
    },
    {
      "id": "https://twitter.com/literarymachine/",
      "type": "Person",
      "name": "Felix Ostrowski"
    }
  ],
  "about": [
    {
      "id": "https://skohub.io"
    }
  ],
  "id": "https://blog.lobid.org/2020/10/09/skohub-apconf.html",
  "datePublished": "2020-10-09",
  "inLanguage": [
    "en"
  ],
  "license": "https://creativecommons.org/licenses/by/4.0/"
}