{
  "@context": "https://schema.org",
  "type": "BlogPosting",
  "name": {
    "en": "Improved GND reconciliation for OpenRefine"
  },
  "creator": [
    {
      "id": "http://lobid.org/team/fs#!",
      "type": "Person",
      "name": "Fabian Steeg"
    }
  ],
  "about": [
    {
      "id": "https://lobid.org"
    }
  ],
  "id": "https://blog.lobid.org/2019/08/19/openrefine.html",
  "datePublished": "2019-08-19",
  "inLanguage": [
    "en"
  ],
  "license": "https://creativecommons.org/licenses/by/4.0/"
}