{
  "@context": "https://schema.org",
  "type": "BlogPosting",
  "name": {
    "en": "Presenting the SkoHub Editor"
  },
  "creator": [
    {
      "id": "http://lobid.org/team/ap#!",
      "type": "Person",
      "name": "Adrian Pohl"
    },
    {
      "id": "https://twitter.com/literarymachine/",
      "type": "Person",
      "name": "Felix Ostrowski"
    }
  ],
  "about": [
    {
      "id": "https://lobid.org"
    }
  ],
  "id": "https://blog.lobid.org/2020/03/31/skohub-editor.html",
  "datePublished": "2020-03-31",
  "inLanguage": [
    "en"
  ],
  "license": "https://creativecommons.org/licenses/by/4.0/"
}